{
  "id": "golden-overloaded-db",
  "version": 1,
  "nodes": [
    {
      "id": "c",
      "type": "client",
      "name": "Clients",
      "position": {
        "x": 0,
        "y": 0
      },
      "properties": {},
      "capacity": {},
      "availability": {},
      "deployment": {}
    },
    {
      "id": "api",
      "type": "api",
      "name": "API",
      "position": {
        "x": 260,
        "y": 0
      },
      "properties": {
        "auth": true,
        "metrics": true,
        "logs": true,
        "tracing": true,
        "alerts": true
      },
      "capacity": {},
      "availability": {
        "replicas": 1
      },
      "deployment": {}
    },
    {
      "id": "mongo",
      "type": "mongodb",
      "name": "Catalog",
      "position": {
        "x": 520,
        "y": 0
      },
      "properties": {},
      "capacity": {},
      "availability": {},
      "deployment": {}
    }
  ],
  "edges": [
    {
      "id": "e1",
      "source": "c",
      "target": "api",
      "traffic_type": "sync_request",
      "protocol": "https"
    },
    {
      "id": "e2",
      "source": "api",
      "target": "mongo",
      "traffic_type": "sync_request",
      "protocol": "https"
    }
  ],
  "traffic_model": {
    "rps": 80000,
    "read_ratio": 0.85
  },
  "requirements": []
}
